url,name,address,city,state,phone
http://www.martinezlawcpa.com/,Diana Martinez Attorney - CPA PLLC,"7801 Broadway Suite 220, San Antonio, TX 78209",San Antonio,TX,(210) 973-7337
https://dianachapacpa.com/,Diana Chapa CPA LLC,,Diana,TX,(210) 913-7469
https://kimberlybagleycpa.com/,Kimberly Bagley CPA PLLC,,Diana,TX,(903) 225-5173
https://henrypeters.com/,"Henry & Peters, PC – Longview","2101 Judson Rd, Longview, TX 75605",Longview,TX,(903) 758-0648
https://ianbrennercpa.com/,"Ian Brenner, CPA","100 E Jefferson St Suite 4, Gilmer, TX 75644",Gilmer,TX,(903) 402-1331
http://www.dmsandassoc.com/,DMS & Associates,"510 E Loop 281 Ste B809, Longview, TX 75605",Longview,TX,(512) 366-8529
http://www.daphnegrimescpa.com/,Daphne A Grimes CPA,"109 W Tyler St A, Gilmer, TX 75644",Gilmer,TX,(903) 680-2800
https://sinclaircpa.com/,"Phillip G. Sinclair, CPA - Longview Texas","1800 Judson Rd, Longview, TX 75605",Longview,TX,(903) 753-5871
http://www.davidmhayescpa.com/,"David M. Hayes, CPA, PLLC","1121 N Longview St, Kilgore, TX 75662",Kilgore,TX,(903) 238-8200
http://www.ttanda.com/,Tommy N Thomas and Associates,"2836 Bill Owens Pkwy, Longview, TX 75605",Longview,TX,(903) 297-9933
https://dellercpa.com/,Conrad B. Deller CPA PLLC,"911 W Loop 281 Ste 211-43, Longview, TX 75604",Longview,TX,(903) 752-8147
