url,name,address,city,state,phone
http://www.klcoopercpa.com/,Cooper Jr Kenneth L CPA,"ÓÉą123 W Harvey Ave, Wellington, KS 67152",Wellington,KS,Óāį(620) 326-5984
http://dbernscpa.com/,David Berns CPA,"ÓÉą12773 Forest Hill Blvd Suite 217, Wellington, FL 33414",Wellington,FL,Óāį(561) 792-9068
http://www.bordeauxcpa.com/,"Bordeaux Spillane, & Zahul CPA's PA","ÓÉą12788 Forest Hill Blvd Ste 2005, Wellington, FL 33414",Wellington,FL,Óāį(561) 790-1488
http://ckuntzcpa.com/,Kuntz Charles F CPA,"ÓÉą111 W Texas Ave, Wheeler, TX 79096",Wheeler,TX,Óāį(806) 826-5516
http://www.bepcocpa.com/,"Brewer, Eyeington, Patout, & Co., LLP: Bryan CPA","ÓÉą111 E 27th St Ste 100, Bryan, TX 77803",Bryan,TX,Óāį(979) 268-1350
http://azybachcpa.com/,Amy Zybach CPA,"ÓÉą1122 S Main St, Wheeler, TX 79096",Wheeler,TX,Óāį(806) 334-1822
http://www.pw-tx.com/,"Prothro Wilhelmi & Co, PLLC","ÓÉą6855 Oak Hill Blvd, Tyler, TX 75703",Tyler,TX,Óāį(903) 534-8811
http://www.josephgeorgecpa.com/,"Joseph George, CPA, PLLC","ÓÉą1902 Sybil Ln Ste. 100, Tyler, TX 75703",Tyler,TX,Óāį(903) 508-4445
https://fmunozcpa.com/,Mu√Īoz CPA LLC,"ÓÉą2021 W Freddy Gonzalez Dr, Edinburg, TX 78539",Edinburg,TX,Óāį(956) 219-3693
http://www.txdmv.gov/tax-assessor-collectors/county-tax-offices,Tax Assessor Collectors Office,"ÓÉą800 West Ave #107, Wellington, TX 79095",Wellington,TX,Óāį(806) 447-5606
http://www.co.collingsworth.tx.us/page/collingsworth.County.Treasurer,Collingsworth County Treasurer‚Äôs Office,"ÓÉą800 West Ave, Wellington, TX 79095",Wellington,TX,Óāį(806) 447-2616
http://www.andra-cpa.com/,"Chad A. Andra, CPA, LLC","ÓÉą207 N Washington Ave, Wellington, KS 67152",Wellington,KS,Óāį(620) 326-3375
